{
  "$schema": "https://json-schema.org/draft/2020-12/schema",
  "$id": "https://eidos.equifax.dev/eidos.contract.schema.json",
  "title": "Forge component contract",
  "description": "The single machine-readable definition of 'a Forge component is Done', spanning four surfaces: docs page, @eidos/ui export, Storybook story, registry item. Validated by scripts/check-contract.mjs.",
  "type": "object",
  "required": ["version", "clauses", "components"],
  "additionalProperties": false,
  "properties": {
    "version": { "type": "string", "description": "Contract semver. Bump when a clause is added or changed." },
    "dsVersion": { "type": "string", "description": "Mirror of DS_VERSION (src/lib/site.ts). check-contract asserts equality." },
    "generated": { "type": "boolean", "description": "True once components[] is synced from disk by forge-gen contract --sync." },
    "surfaces": { "type": "array", "items": { "enum": ["docs", "export", "story", "registry", "cross", "tokens"] } },
    "clauses": {
      "type": "array",
      "minItems": 1,
      "items": {
        "type": "object",
        "additionalProperties": false,
        "required": ["id", "title", "surface", "verifier", "gate", "rule"],
        "properties": {
          "id": { "type": "string", "pattern": "^C-[a-z0-9-]+$" },
          "title": { "type": "string" },
          "surface": { "enum": ["docs", "export", "story", "registry", "cross", "tokens"] },
          "rule": { "type": "string", "description": "One-line plain statement of the invariant." },
          "verifier": { "type": "string", "description": "Verifier id (see scripts/eidos-lib.mjs VERIFIERS) or EXT:<npm-script>." },
          "gate": { "enum": ["block", "advisory"], "description": "block = exits CI/Stop nonzero on fail; advisory = reported only." },
          "appliesTo": {
            "type": "array",
            "items": { "enum": ["component", "foundation", "ai", "example", "overview", "all"] },
            "default": ["component"]
          },
          "since": { "type": "string" },
          "adr": { "type": "string", "description": "Optional docs/adr/NNNN slug citing the settled decision." }
        }
      }
    },
    "components": {
      "type": "array",
      "description": "One entry per component, generated by `forge gen contract --sync`.",
      "items": {
        "type": "object",
        "additionalProperties": false,
        "required": ["name", "kind", "surfaces"],
        "properties": {
          "name": { "type": "string", "description": "Canonical slug — the join key across surfaces (e.g. 'metric-card')." },
          "kind": { "enum": ["component", "foundation", "ai", "example", "overview"] },
          "ds": { "enum": ["core", "charts", "ai", "idp", "patterns", "mobile", "blocks"] },
          "title": { "type": "string" },
          "surfaces": {
            "type": "object",
            "additionalProperties": false,
            "properties": {
              "docs": { "type": "string", "description": "src/ds/migrated path, or '' if N/A." },
              "export": { "type": "string", "description": "@eidos/ui export name (e.g. 'MetricCard')." },
              "exportFile": { "type": "string", "description": "File the export actually lives in (e.g. 'packages/ui/src/blocks.tsx'). REQUIRED for grouped barrels." },
              "story": { "type": "string", "description": "stories path." },
              "registry": { "type": "string", "description": "registry item name → public/r/<name>.json." },
              "registrySrc": { "type": "string", "description": "packages/registry/src/forge/<name>.tsx path." }
            }
          }
        }
      }
    },
    "waivers": {
      "type": "array",
      "description": "Explicit, reviewed exceptions. A clause failure with a matching, non-expired waiver resolves to status 'waived' — never silently 'pass'/green.",
      "items": {
        "type": "object",
        "additionalProperties": false,
        "required": ["component", "clause", "reason"],
        "properties": {
          "component": { "type": "string" },
          "clause": { "type": "string", "pattern": "^C-[a-z0-9-]+$" },
          "reason": { "type": "string", "minLength": 1, "description": "Non-empty justification. Required." },
          "expires": { "type": "string", "format": "date", "description": "Optional ISO date; after it the waiver no longer applies." }
        }
      }
    }
  }
}
