{
  "$schema": "./eidos.contract.schema.json",
  "version": "1.0.0",
  "dsVersion": "1.28.1",
  "generated": true,
  "surfaces": [
    "docs",
    "export",
    "story",
    "registry",
    "cross",
    "tokens"
  ],
  "clauses": [
    {
      "id": "C-docs-exists",
      "title": "Docs page renders",
      "surface": "docs",
      "gate": "block",
      "appliesTo": [
        "component",
        "foundation",
        "ai",
        "example"
      ],
      "rule": "A migrated page exists at the bound path, default-exports, imports primitives from @/ds/core, and headless-renders with no thrown error / React console.error.",
      "verifier": "verify-render",
      "since": "1.0.0"
    },
    {
      "id": "C-docs-sections",
      "title": "Section order",
      "surface": "docs",
      "gate": "block",
      "appliesTo": [
        "component",
        "ai"
      ],
      "rule": "SubHead meta order matches docs/ds-page-standard.json: Installation -> Usage -> Variants/Sizes/States -> [In context] -> Accessibility -> RTL -> Anatomy -> Do/Don't -> API reference.",
      "verifier": "check-ds-page-structure",
      "since": "1.0.0"
    },
    {
      "id": "C-a11y-section",
      "title": "Accessibility section",
      "surface": "docs",
      "gate": "block",
      "appliesTo": [
        "component",
        "ai"
      ],
      "rule": "Page has a SubHead meta=\"a11y\" section mentioning keyboard + ARIA + contrast + reduced-motion.",
      "verifier": "check-ds-page-structure",
      "since": "1.0.0"
    },
    {
      "id": "C-rtl-frame",
      "title": "RTL frame",
      "surface": "docs",
      "gate": "block",
      "appliesTo": [
        "component",
        "ai"
      ],
      "rule": "Page has a live Frame dir=\"rtl\" with Arabic copy, or a matching waiver (foundations/CSS-only).",
      "verifier": "check-ds-page-structure",
      "since": "1.0.0"
    },
    {
      "id": "C-anatomy",
      "title": "Visual anatomy",
      "surface": "docs",
      "gate": "block",
      "appliesTo": [
        "component",
        "ai"
      ],
      "rule": "Anatomy is rendered: .ana > .stage with numbered .pin + .lead connectors + numbered .ana-list legend (never a prose list).",
      "verifier": "check-ds-page-structure",
      "since": "1.0.0"
    },
    {
      "id": "C-do-dont",
      "title": "Do/Don't grid",
      "surface": "docs",
      "gate": "block",
      "appliesTo": [
        "component",
        "ai",
        "foundation"
      ],
      "rule": "Do/Don't uses .dd-grid.",
      "verifier": "check-ds-page-structure",
      "since": "1.0.0"
    },
    {
      "id": "C-autopropstable",
      "title": "Generated API table",
      "surface": "docs",
      "gate": "block",
      "appliesTo": [
        "component",
        "ai"
      ],
      "rule": "API reference uses <AutoPropsTable component=\"<export>\"/>; no hand-authored table/PropsTable for a real export.",
      "verifier": "check-ds-page-structure",
      "since": "1.0.0"
    },
    {
      "id": "C-lede",
      "title": "Header lede budget",
      "surface": "docs",
      "gate": "block",
      "appliesTo": [
        "component",
        "foundation",
        "ai"
      ],
      "rule": "Header lede <=220 chars, plain text (no markup).",
      "verifier": "check-ds-page-structure",
      "since": "1.0.0"
    },
    {
      "id": "C-no-page-style",
      "title": "No per-page style",
      "surface": "docs",
      "gate": "block",
      "appliesTo": [
        "component",
        "foundation",
        "ai",
        "example"
      ],
      "rule": "No <style> block and no inline style={{ color|fontSize|padding|margin|background }} in migrated pages; compose .ds-* + var(--token).",
      "verifier": "check-no-page-style",
      "since": "1.0.0"
    },
    {
      "id": "C-frame-parses",
      "title": "Frame snippets parse",
      "surface": "docs",
      "gate": "block",
      "appliesTo": [
        "component",
        "ai",
        "example"
      ],
      "rule": "Every Frame/CodeBlock/TabbedCode snippet TS-parses; a // @forge-frame:<storyId> Frame must equal its source story (no structural drift).",
      "verifier": "check-frame-code",
      "since": "1.0.0"
    },
    {
      "id": "C-no-slop",
      "title": "No AI slop",
      "surface": "docs",
      "gate": "advisory",
      "appliesTo": [
        "component",
        "ai",
        "example"
      ],
      "rule": "No emoji feature-icons, no invented metrics, no filler copy, no placeholder CDNs, no hardcoded font-family outside var(--font-*).",
      "verifier": "check-slop",
      "since": "1.0.0"
    },
    {
      "id": "C-links-resolve",
      "title": "Links resolve",
      "surface": "cross",
      "gate": "block",
      "appliesTo": [
        "component",
        "foundation",
        "ai",
        "example"
      ],
      "rule": "Every nav href resolves to a page/example; every page (except overview) is in nav; in-body anchors resolve.",
      "verifier": "check-nav",
      "since": "1.0.0"
    },
    {
      "id": "C-export",
      "title": "Barrel export + parity",
      "surface": "export",
      "gate": "block",
      "appliesTo": [
        "component",
        "ai"
      ],
      "rule": "Component is exported from packages/ui/src/index.ts barrel (resolved via surfaces.exportFile) and all four surfaces resolve.",
      "verifier": "check-4-surface-parity",
      "since": "1.0.0"
    },
    {
      "id": "C-typecheck",
      "title": "Typecheck clean",
      "surface": "export",
      "gate": "block",
      "appliesTo": [
        "component",
        "ai"
      ],
      "rule": "tsc --noEmit clean for @eidos/ui.",
      "verifier": "EXT:ui:typecheck",
      "since": "1.0.0"
    },
    {
      "id": "C-story",
      "title": "CSF3 story exists",
      "surface": "story",
      "gate": "block",
      "appliesTo": [
        "component",
        "ai"
      ],
      "rule": "A CSF3 story exists; meta.title prefix is in preview.ts storySort.order AND matches its folder group; tags include 'autodocs'.",
      "verifier": "check-stories",
      "since": "1.0.0"
    },
    {
      "id": "C-story-matrix",
      "title": "Variant/state matrix",
      "surface": "story",
      "gate": "advisory",
      "appliesTo": [
        "component"
      ],
      "rule": ">=1 story per documented variant x state (incl. a States story); story renders in {dark,light} x {ltr,rtl} via the existing decorators.",
      "verifier": "check-stories",
      "since": "1.0.0"
    },
    {
      "id": "C-story-a11y",
      "title": "Story a11y",
      "surface": "story",
      "gate": "advisory",
      "appliesTo": [
        "component",
        "ai"
      ],
      "rule": "@storybook/addon-a11y / test-runner reports no critical/serious violations for the story.",
      "verifier": "EXT:sb:test",
      "since": "1.0.0"
    },
    {
      "id": "C-registry",
      "title": "Registry item valid",
      "surface": "registry",
      "gate": "block",
      "appliesTo": [
        "component",
        "ai"
      ],
      "rule": "A registry item exists; public/r/<name>.json builds; $schema valid; registryDependencies acyclic and present; files[].source resolve.",
      "verifier": "check-registry",
      "since": "1.0.0"
    },
    {
      "id": "C-registry-sync",
      "title": "Registry source in sync",
      "surface": "registry",
      "gate": "block",
      "appliesTo": [
        "component",
        "ai"
      ],
      "rule": "Registry source (surfaces.registrySrc) matches its bound @eidos/ui source (surfaces.exportFile) — no drift. Bound via the explicit mapping, not a filename convention.",
      "verifier": "check-registry",
      "since": "1.0.0"
    },
    {
      "id": "C-cli-install",
      "title": "CLI install resolves deps",
      "surface": "registry",
      "gate": "block",
      "appliesTo": [
        "component",
        "ai"
      ],
      "rule": "eidos add <name> resolves the FULL transitive registryDependency graph and refuses to write if any dep is missing.",
      "verifier": "EXT:cli:test",
      "since": "1.0.0"
    },
    {
      "id": "C-visual",
      "title": "No visual drift",
      "surface": "cross",
      "gate": "advisory",
      "appliesTo": [
        "component",
        "foundation",
        "ai",
        "example"
      ],
      "rule": "No unexplained pixel drift vs tests/visual-baselines.",
      "verifier": "check-visual",
      "since": "1.0.0"
    },
    {
      "id": "C-contrast-fill",
      "title": "Contrast on fills",
      "surface": "cross",
      "gate": "block",
      "appliesTo": [
        "component",
        "ai"
      ],
      "rule": "Any foreground on an accent/elevated FILL is explicitly contrasting (dark ink on ember; light on dark; >=4.5:1 body / 3:1 UI). Token tertiary tiers (--fg-subtle/--fg-faint) remain advisory by design.",
      "verifier": "check-contrast-fill",
      "since": "1.0.0"
    },
    {
      "id": "C-a11y-axe",
      "title": "axe structural",
      "surface": "cross",
      "gate": "block",
      "appliesTo": [
        "component",
        "foundation",
        "ai",
        "example"
      ],
      "rule": "axe-core WCAG A/AA structural rules pass (color-contrast stays advisory per design decision).",
      "verifier": "check-a11y",
      "since": "1.0.0"
    },
    {
      "id": "C-tokens-dtcg",
      "title": "DTCG tokens in sync",
      "surface": "tokens",
      "gate": "block",
      "appliesTo": [
        "all"
      ],
      "rule": "tokens/forge.tokens.json is regenerated and in sync with the canonical packages/ui/styles/tokens.css (CSS is source; DTCG is export).",
      "verifier": "gen-tokens-check",
      "since": "1.0.0"
    },
    {
      "id": "C-contract-valid",
      "title": "Contract valid",
      "surface": "cross",
      "gate": "block",
      "appliesTo": [
        "all"
      ],